title,genre,artists,song_desc,youtube_url
INSANE!,Dubstep,"Excision, SVDDEN DEATH, YMV3","A 3:20 track at 140 BPM in B minor, featuring syncopated bass patterns and blistering drums, blending dubstep with deathcore elements for a punishing, neck-snapping experience. Released on June 6, 2025, via Subsidia, it debuted during and 's B2B set at The Thunderdome. Listeners have praised its intensity, with comments like ""absolute fire!"" and ""this is insane.""",https://www.youtube.com/watch?v=meoWTGZFsls
Our Fire VIP,Dubstep,"Excision, Sullivan King","A high-energy dubstep track blending aggressive metalcore vocals with heavy bass drops, featuring distorted guitar riffs and rapid, syncopated rhythms. The VIP mix intensifies the original with enhanced basslines and additional screamo elements, creating a more dynamic listening experience. Listeners have praised its intensity, with comments like ""Fucking insane"" and ""oh the basssss.""",https://www.youtube.com/watch?v=s73UYzaKuII
Titans,Dubstep,"Excision, Wooli","A 3:30 track in F minor at 128 BPM, blending bass house with halftime drops; features aggressive basslines, complex sound design, and samples from 2019's ""Lockdown."" Released on 's Subsidia Records, it showcases the duo's mastery of bass-heavy music, with intense energy and captivating sound.; groove‑locked percussion; off‑beat hats; sustained chords; build‑to‑peak energy curve",https://www.youtube.com/watch?v=KeDF-VjEfp0
F.Y.U.,Dubstep,"Excision, Kai Wachi","Aggressive dubstep track at 150 BPM in G# minor, featuring gritty basslines, mechanical growls, and over-the-top vocal samples reminiscent of early dubstep mixes. Released on November 17, 2023, under Subsidia Records, it has been described as a ""sonic explosion of heavy dubstep"" with ""intense basslines, aggressive synths, and adrenaline-pumping drops.""",https://www.youtube.com/watch?v=X90JzNNXFuY
Don't Look Down (Hold On),Melodic Dubstep,"Excision, Wooli, Codeko","A dynamic collaboration blending melodic bass and dubstep, featuring haunting keys and impassioned vocals, building to uplifting drops and heavy-hitting basslines.; focused arrangement; clear motif development; dynamic contour with defined peaks; contrast between sparse verses and dense climaxes; ear‑catching transitions",https://www.youtube.com/watch?v=pYzLDNR4DfM
Drowning,Dubstep,"Excision, Akylla","A cinematic dubstep track featuring orchestral strings and dark ambient synths, creating an ominous atmosphere. 's powerful vocals add depth to the production. The song has a tempo of 139.5 BPM and is in the key of C♯/D♭. It has a duration of 3:58. The track is part of 's 2016 album ""Virus, "" which includes collaborations with artists like Datsik, Prototype, and Dion Timmer.",https://www.youtube.com/watch?v=d37x0Mw95_A
Lockdown,Dubstep,"Excision, Wooli","Opens with apocalyptic siren, leading into heavy dubstep with deep drops and screeching synths; features pounding basslines and rhythmic precision; includes vocals from Sam King; showcases 's sound design and 's hard-hitting synths; described as a heavy tune with prehistoric vibes; received positive reactions in live settings; part of collaborative EP ""Evolution"" released in 2019.",https://www.youtube.com/watch?v=SiMpNiolJ-0
Rumble,Dubstep,"Excision, Space Laces","A 4:42 track in E major at 113 BPM, featuring thunderous drums, laser-like synths, and a prominent ""Let's get ready to !"" sample. The song transitions from dreamy, tribal build-ups to aggressive, headbanging drops, showcasing complex sound design and powerful basslines. It was supported by bass music titans such as Getter, Kayzo, SKisM, NGHTMRE, 12th Planet, Snails, Downlink, Jarvis, and Virtual Riot.",https://www.youtube.com/watch?v=9COJCBMmjY0
JUMP OUT,Dubstep,"Excision, Juelz","A 2:25 dubstep track in A minor at 124 BPM, featuring deep sub-bass, aggressive growls, and glitchy synths; released July 19, 2024, on Subsidia.; focused arrangement; clear motif development; dynamic contour with defined peaks; layered textures; tasteful automation; tight low‑end management; polished master",https://www.youtube.com/watch?v=nOp57ck-1Rs
Feel Something,Melodic Bass,"Excision, I Prevail","A genre-blending anthem fusing melodic dubstep, dance-pop, and metalcore, featuring impassioned vocals from 's Brian Burkheiser and Eric Vanlerberghe, set against a backdrop of glitch-hop-inspired basslines and aggressive synths. The track opens with haunting guitar lines, building into a dynamic future bass drop, followed by a second drop with heavy metal screams and thunderous low-end saws. The accompanying lyric video features Illenium's phoenix and 's dinosaur mascots, symbolizing the clash",https://www.youtube.com/watch?v=pp4YQPykBMM
Air,EDM/Electronic,"Excision, Julia Michaels","A 2:40 track in F♯ minor at 140 BPM, featuring cinematic synths, bright piano chords, and ' emotive vocals. The arrangement builds from progressive synth leads into dynamic bass stabs, blending melodic dubstep with cinematic textures. The second drop introduces dubstep elements, filtered through a melodic lens to inspire movement without overwhelming force.",https://www.youtube.com/watch?v=2XQEruKtR5c
Together As One,Dubstep,Excision,"A high-energy dubstep track featuring aggressive basslines, rapid tempo, and cinematic sound design, incorporating voice clips from the upcoming ""Transformers One"" film, blending heavy sub-bass drops with sci-fi-inspired elements.; contrast between sparse verses and dense climaxes; ear‑catching transitions",https://www.youtube.com/watch?v=R3-kvQ3cIFE
Island,Melodic Dubstep,"Seven Lions, Wooli, Trivecta, Nevve","Euphoric melodic dubstep track featuring ethereal vocals, gentle piano intro, and airy synths, building into intense, bass-heavy drops with heavy dubstep elements, blending blissful melodies with abrasive basslines, released on Ophelia Records.; focused arrangement; clear motif development; dynamic contour with defined peaks",https://www.youtube.com/watch?v=1IFNx68qfPY
Last Ride,Melodic Dubstep,Wooli,"A dynamic track blending aggressive dubstep with melodic elements, featuring rapid 140 BPM tempo, D minor key, 4/4 time signature, and approximately 3-minute duration. Characterized by deep sub-bass, sharp snare hits, and atmospheric synths, it showcases a fusion of brostep and riddim styles, creating an intense yet emotive listening experience. The production emphasizes cinematic build-ups leading into heavy drops, reflecting the artist's signature ""briddim"" style.",https://www.youtube.com/watch?v=pYzLDNR4DfM
Watch Out,Dubstep,Wooli,"A high-energy dubstep track featuring aggressive basslines, syncopated rhythms, and dynamic drops, blending heavy dubstep elements with melodic undertones. The producer, known for fusing hard dubstep bass drops with airy vocals and emotional melodies—a mix of riddim and brostep he calls “briddim” The track has received positive listener feedback, with comments like ""gave me goosebumps""",https://www.youtube.com/watch?v=fOMAnkKQZus
Take Me There,Melodic Bass,"Wooli, Trivecta","A collaboration between two prominent figures in the melodic dubstep scene, this track features a tempo of 140 BPM in the key of C minor, structured in a 4/4 time signature. It opens with a warm guitar riff, leading into a soaring synth melody that builds tension before dropping into a heavy, bass-driven section. The track seamlessly blends organic instrumentation with electronic elements, creating an emotive atmosphere that resonates with listeners. Notably, the song has been praised for its",https://www.youtube.com/watch?v=9DZTRKvzxGk
Fly Away,Melodic Dubstep,"Wooli, G Jones","Mid-tempo 140 BPM track in D minor, 4/4 time, 3:30 duration, featuring deep sub-bass, glitchy percussion, atmospheric synths, and ethereal vocal samples; dynamic build-ups and drops create an immersive, otherworldly atmosphere.; focused arrangement; clear motif development; dynamic contour with defined peaks",https://www.youtube.com/shorts/SsQZgNyTHbE
Name Drop,Dubstep/Bass,"Excision, Wooli","High-energy dubstep track featuring bone-rattling bass drops, distorted snares, and mechanical synths; tempo around 140 BPM; key in C minor; 4/4 time signature; duration approximately 3 minutes; instrumentation includes electric guitar riffs, heavy bass lines, and vocal samples from Dwayne ""The Rock"" Johnson's ""Face Off"" with Tech N9ne; structure alternates between atmospheric builds and intense drops; themes of self-assertion and audience engagement.",https://www.youtube.com/watch?v=QT49aui86wQ
Untouchable,Melodic Dubstep,"Wooli, Seven Lions, Krewella","A high-energy electronic track blending dubstep and melodic bass, featuring rapid 140 BPM tempo, D minor key, 4/4 time signature, and approximately 3-minute duration. Characterized by aggressive basslines, sharp synths, and emotive melodies, it showcases a fusion of hard-hitting drops with atmospheric build-ups. The collaboration between prominent artists in the bass music scene results in a dynamic and captivating listening experience.",https://www.youtube.com/watch?v=8bNlGwnEUAs
Hurt,Melodic Bass,"Wooli, Trivecta","A collaboration between two prominent electronic music producers, this track features a blend of melodic dubstep and bass elements. The song opens with emotive vocals, leading into a buildup that transitions into a powerful drop characterized by heavy basslines and dynamic synths. The production showcases a fusion of styles, combining elements of dubstep and melodic bass music. The track has been well-received by fans and critics alike, with some describing it as a ""melodic dubstep",https://www.youtube.com/watch?v=pfBUHtk_-H4
Snowblind,Dubstep,"Wooli, Trivecta","A dynamic collaboration between two prominent electronic music producers, this track seamlessly blends melodic dubstep with elements of rock, featuring soaring vocals and powerful basslines. The song showcases a fusion of electronic and rock elements, creating a unique and energetic listening experience. The track's production is characterized by its emotive melodies and driving rhythms, reflecting the artists' ability to merge different musical styles effectively. This collaboration highlights",https://www.youtube.com/shorts/jXUeYS44lic
Call Me,Melodic Dubstep,Wooli,"A dynamic dubstep track featuring aggressive basslines, rapid-fire snares, and syncopated rhythms, blending heavy drops with melodic elements; characterized by a tempo of approximately 140 BPM, set in a minor key, and structured in a 4/4 time signature; incorporates distorted synths, deep sub-bass, and atmospheric pads, creating an intense yet emotive atmosphere.",https://www.youtube.com/watch?v=pYzLDNR4DfM
See U Again,Melodic Bass,"Wooli, Grant","A poignant hip-hop ballad blending emotive rap verses with soulful vocals, set in B♭ major at 80 BPM, featuring a gentle piano-driven melody and subtle orchestral elements, creating an atmosphere of reflection and introspection. The track's themes of loss, remembrance, and enduring bonds resonate deeply, serving as a heartfelt tribute to a beloved figure. Its widespread popularity is evident, topping charts worldwide and becoming one of the best-selling digital singles of all time. The music",https://www.youtube.com/watch?v=Cs_Sp--_cl8
endlessly,Pop/Indie Pop,Bixby,"Mid-tempo pop ballad in F minor, 72 BPM, featuring airy falsetto vocals, warm guitar strums, and subtle programmed drums. Lyrically, it delves into themes of love, loss, and longing, portraying a cycle of hope and disappointment. The sparse instrumentation and emotive delivery create an intimate atmosphere, resonating with listeners through its raw honesty and relatable narrative.",https://www.youtube.com/watch?v=0E61_2KcozI
whyy,Pop/R&B,Bixby,"A 2:06 pop track in C minor, 4/4 time, 90 BPM, featuring airy falsetto vocals, warm guitar, and programmed drums, exploring existential questioning and emotional turmoil.; verse–pre–hook–chorus form; earworm motif; tight vocal comp; plate reverb; mid‑tempo groove; bright acoustic elements; soft saturation on bus",https://www.youtube.com/watch?v=cLvT4uFVOH4
"darling, he lied",Alt Pop,Bixby,"A 2:38 track in G♯/A♭ major at 152 BPM, featuring airy falsetto vocals, soft guitar strumming, and lo-fi beats, creating a warm, nostalgic atmosphere. The song delves into themes of betrayal and longing, with lyrics exploring the complexities of love and deception. Listeners have praised its emotive delivery and relatable themes, noting its ability to evoke deep emotional responses.",https://www.youtube.com/watch?v=1gTt7fg6-Bw
desire,Indie Pop,Bixby,"Upbeat indie pop-rock track featuring raspy vocals and distorted guitar, blending danceable rhythms with emotional vulnerability. The song's production creates tension and nostalgia, drawing listeners into memories of a lost romance. Released in August 2024, it has been well-received for its catchy melody and relatable themes.",https://www.youtube.com/watch?v=fL5HukElM8o
distance,Bedroom Pop,Bixby,"Upbeat pop track in G major at 127 BPM, 1:53 duration, featuring catchy hooks, airy background instruments, and relatable lyrics. Released February 23, 2024, by Dog Show Records. Performed live at Head In The Clouds 2025 in Pasadena, CA.; mid‑tempo groove; bright acoustic elements; soft saturation on bus",https://www.youtube.com/watch?v=OXVDrGfOMnc
both of us,Indie Pop,Bixby,"Mid-tempo indie pop track featuring airy falsetto vocals, warm guitar strums, and subtle electronic elements; introspective lyrics explore trust and personal boundaries within relationships; released December 9, 2022; received positive listener feedback for its emotive delivery and relatable themes.",https://www.youtube.com/watch?v=NCa7-BpYTIw
are you sleeping alone again?,Alt Pop,Bixby,"A 2-minute, 6-second track in A# major at 140 BPM, featuring Bradley Au's emotive falsetto over a blend of acoustic guitar and subtle electronic elements, creating a warm, melancholic atmosphere. The song delves into themes of heartbreak and longing, with lyrics expressing vulnerability and emotional depth. Released on January 13, 2023, it showcases Au's ability to convey raw emotion through his music.",https://www.youtube.com/watch?v=xjPyi5n9890
easy,Pop,Bixby,"Upbeat indie pop-rock track with distorted guitar riffs, raspy vocals, and danceable rhythm; captures nostalgia and longing; blends emotional vulnerability with energetic tempo; perfect for spring vibes.; clean topline; layered harmonies; glossy synth pads; punchy drums; verse–pre–hook–chorus form; earworm motif; tight vocal comp; plate reverb",https://www.youtube.com/watch?v=y9NPG50XHJg
dying to see you,Pop,Bixby,"Mid-tempo pop ballad in C Major at 70 BPM, 2:22 duration, featuring emotive vocals, airy background instruments, and introspective lyrics about longing and reconciliation. Released November 18, 2022, by Dog Show Records.; verse–pre–hook–chorus form; earworm motif; tight vocal comp; plate reverb; groove‑locked percussion; off‑beat hats; sustained chords; build‑to‑peak energy curve",https://www.youtube.com/watch?v=HiBVYzGN41Q
moving on,Pop/R&B,Bixby,"Mid-tempo pop track in C major, 4/4 time signature, approximately 100 BPM, 3 minutes 30 seconds. Features warm guitar strums, airy falsetto vocals, programmed drums, sub-bass, lo-fi sheen. Explores themes of love, loss, and personal growth. Collaborative effort with Frocious, blending energetic pop rhythms with deep melodies. Notable for its catchy hook and expressive live performances.",https://www.youtube.com/watch?v=fAr3mfltw2I
throw ur life away,Pop,"Bixby, Endie, roan, recycleBin","Mid-tempo pop track in E♭ minor, 110 BPM, 2:56 duration, featuring layered vocals, airy falsetto, warm guitar, and programmed drums. Lyrically, it delves into insecurities, self-doubt, and romantic complexities. Notable for its relatable themes and emotive delivery, it has garnered positive listener feedback, with comments like ""so cool!!"" and ""music to get freaky too.""",https://www.youtube.com/watch?v=v7bsSAEYzDM
bittersweet teeth,Alt Pop,"Bixby, Poptropicaslutz!, NOT A TOY","Upbeat 170 BPM track in B major, blending distorted power chords with pulsating programmed drums and sparkling alt-pop synths. Features reverb-drenched vocals, creating a catchy, edgy pop-punk energy. Lyrically, it explores capturing fleeting moments in relationships, emphasizing the allure of genuine smiles and the desire to preserve happiness. Released on September 21, 2022, as part of the ""Face for the Radio"" album.",https://www.youtube.com/watch?v=Y-05g57tBD0
deep in love,Pop/EDM,"Bixby, Noahh","A 2:52 hyperpop track in A major at 168 BPM, featuring 's introspective vocals, 's emotive delivery, and Kaido's verse, over a dynamic, glitchy beat with layered synths and punchy percussion, exploring themes of unrequited love and emotional turmoil.; clean topline; layered harmonies; glossy synth pads; punchy drums",https://www.youtube.com/shorts/ofgQkjcjqPo
taste of melancholy,Indie Pop,Bixby,"Mid-tempo indie pop track with warm falsetto vocals, lo-fi sheen, and programmed drums; introspective lyrics explore communication breakdowns and internal doubts in relationships.; clean topline; layered harmonies; glossy synth pads; punchy drums; mid‑tempo groove; bright acoustic elements; soft saturation on bus",https://www.youtube.com/watch?v=u35NnCfwlBw
the grass is always greener on the other side,Indie Pop,Bixby,"A 2:40 pop track featuring airy falsetto vocals, lo-fi sheen, and introspective lyrics exploring themes of longing, isolation, and self-doubt. The song's structure includes verses expressing feelings of abandonment and internal conflict, a pre-chorus highlighting emotional instability, a chorus emphasizing distance and loss, and a bridge serving as a plea for affirmation. The production is characterized by warm guitar tones and subtle programmed drums, creating a melancholic yet intimate",https://www.youtube.com/watch?v=Oaqdz1I8zm8
running on empty,Pop/R&B,"Bixby, Aldrch","Mid-tempo pop track at 93 BPM in B♭ major, 2:17 duration, featuring warm electric guitar lines, electronic elements, and emotive male and female vocals. Lyrically, it delves into themes of emotional exhaustion and relationship turmoil. Critics praise its infectious melodies and captivating vocal performances, with one reviewer noting, ""I literally haven’t turned it off.""",https://www.youtube.com/watch?v=194l0nCjp7g
don't make me,Pop,Bixby,"Mid-tempo 96 BPM pop track in F major, 4/4 time, 2:05 duration, featuring airy falsetto vocals, warm guitar, subtle synths, and programmed drums, exploring themes of unreciprocated love and emotional exhaustion.; mid‑tempo groove; bright acoustic elements; soft saturation on bus; verse–pre–hook–chorus form; earworm motif; tight vocal comp; plate reverb",https://www.youtube.com/watch?v=QH_1T_7AaYM
Lock In,Dubstep/Bass,"Subtronics, Wooli","A high-energy dubstep track featuring aggressive basslines, rapid tempo, and complex sound design, incorporating a nostalgic Mario Kart countdown sample that adds a playful touch to its intense drops. The track has received mixed reviews, with some listeners praising its energy and others criticizing its repetitiveness.",https://www.youtube.com/watch?v=1JkoEeCOWok
Final Breath,Bass/EDM,"Subtronics, A Little Sound","A collaboration between two prominent figures in electronic music, this track features a fusion of glitchy basslines, atmospheric synths, and dynamic percussion. The song has received positive feedback from listeners, with comments highlighting its emotional depth and impactful drops. Notably, one listener described the second drop as ""best, "" while another noted the track's ""sick"" nature.",https://www.youtube.com/watch?v=mGLHgvvu6K8
Power,Dubstep/Bass,"Subtronics, Level Up, Grabbitz","High-energy dubstep track featuring haunting vocals, aggressive basslines, and intricate sound design. First debuted at EDC Las Vegas 2024, it has become a fan favorite in live shows. The track showcases a blend of hypnotic melodies and hard-hitting drops, with masterful vocal distortion and strategic sound design. It has been performed at major global festivals like Ultra Europe, Ultra Japan, Lost Lands, North Coast Music Festival, and Electric Forest.",https://www.youtube.com/watch?v=2javfeqlYAU
Oblivion,Dubstep/Trap,Subtronics,"Opening with swelling orchestral intro building tension before voice warns, ""Brace yourselves as we enter the portal into the Tesseract, "" leading into earth-shattering dubstep drop loaded with interstellar textures and seismic low-end pressure.; contrast between sparse verses and dense climaxes; ear‑catching transitions",https://www.youtube.com/watch?v=pJ4oTtwpae0
Legends,Dubstep,"Subtronics, P Money","A 2:47 track blending drum & bass and grime, featuring a brooding buildup with tension, followed by a punishing drop fusing heavy bass and tightly programmed drums. British grime MC 's relentless bars ground the madness with determination, providing a lyrical spine to the sonic barrage. Released via Cyclops Recordings, it has been described as a festival weapon and a relentless showcase of drum & bass production and hip-hop grit.",https://www.youtube.com/watch?v=WS0oRNuBSlc
Hunter,Bass,"Subtronics, Flowdan","A relentless dubstep track featuring heavy bass, distorted textures, and filtered sweeps, with a tempo of 140 BPM in a minor key, characterized by a half-time rhythm; the collaboration between and delivers a gritty, high-energy experience.; focused arrangement; clear motif development; dynamic contour with defined peaks",https://www.youtube.com/watch?v=8dYe50jm20s
Into Pieces,Melodic Bass,"Subtronics, Grabbitz","A dynamic electronic track blending dubstep and future bass, featuring a tempo of 140 BPM in a minor key, structured in 4/4 time. The composition showcases deep sub-bass frequencies, glitchy synths, and punchy programmed drums, creating an intense atmosphere. The emotive vocals convey themes of emotional vulnerability and personal transformation, enhanced by atmospheric pads and a prominent bass drop that accentuates the track's emotional intensity. The song's production is characterized by its",https://www.youtube.com/watch?v=_69Z3fscTYg
Gassed Up,Dubstep,"Zeds Dead, Subtronics, Flowdan","A high-energy dubstep track featuring throbbing sub-bass, syncopated programmed drums, and aggressive wobbles, blending vintage dubstep with grime influences; UK grime artist delivers rapid-fire verses over the pulsating beat, creating a dynamic fusion of electronic and hip-hop elements.; focused arrangement; clear motif development; dynamic contour with defined peaks",https://www.youtube.com/watch?v=WiUdWyyvmpQ
Griztronics II (Another Level),Bass,"GRiZ, Subtronics","A high-energy dubstep track at 145 BPM in C major, featuring hard-hitting basslines, intricate wobbles, and glitchy synths, blending 's future funk style with ' cutting-edge sound design, creating an electrifying atmosphere.; focused arrangement; clear motif development; dynamic contour with defined peaks",https://www.youtube.com/watch?v=4fNk2Ya_HSA
Spacetime,Melodic Bass,"Subtronics, Nevve","A 140 BPM dubstep track in E minor, featuring ethereal vocals and lush synths that build into intense, bass-driven drops. The song's structure includes orchestral build-ups leading to heavy dubstep sequences, blending melodic elements with aggressive basslines. Critics praise its anthemic and emotional composition, highlighting its ability to balance melodic flair with powerful dubstep elements.",https://www.youtube.com/watch?v=bdpv-wuY9qo
Puzzle Box,Bass,"Rezz, Subtronics","Midtempo electronic track at 95 BPM in C# major, 4/4 time signature, 3:32 duration, blending dark, hypnotic synths with heavy, wonky basslines; features eerie tones, disconnected laughter, and cascading effects; combines mechanized chaos with minimal, calculated darkness; released on Deadbeats and Cyclops Recordings; proceeds from limited-edition merchandise support Voices of Children Ukraine.",https://www.youtube.com/watch?v=QNFlk2B1ig8
Scream Saver,Dubstep,Subtronics,"Eerie melodies intertwine with shuddering drops and jagged rhythms in this dubstep track, featuring glitchy arpeggios and heavy sub-bass, creating a dark, intense atmosphere.; focused arrangement; clear motif development; dynamic contour with defined peaks; contrast between sparse verses and dense climaxes; ear‑catching transitions",https://www.youtube.com/watch?v=SUraMSU-N2I
Braincase,Dubstep,"Subtronics, Kayzo","A high-energy electronic track blending rock, psytrance, and bass elements, featuring an ominous guitar riff intro, sharp percussion, and booming drum claps; transitions from a bouncy psytrance drop to a heavy dubstep anthem with amplified riddim, stabs, and wobbles; characterized by aggressive basslines, metal guitar work, and playful rhythm; showcases a fusion of styles with unexpected drops and genre-defying production.",https://www.youtube.com/watch?v=hFoaeSs3XTs
House Party,Bass/Trap,"Marshmello, Subtronics","A 75 BPM dubstep track in C# major, featuring heavy sub-bass, quirky synths, and thunderous drops. The 3:25-minute composition includes a spoken-word intro, leading into three massive drops with slithering synths and deep subs. Released on June 10, 2021, as part of the album ""Shockwave, "" it showcases a collaboration between and .",https://www.youtube.com/watch?v=96Y1E-zdQs0
