title,genre,artists,song_desc,youtube_url
Beautiful Restriction,K-Pop/Pop,NewJeans,"A 3:52 ballad in D♯ major at 125 BPM, featuring warm guitar strums, airy falsetto harmonies, and subtle programmed drums, creating a nostalgic atmosphere reminiscent of 1990s K-drama soundtracks. The track's structure emphasizes emotive vocal delivery, with a poignant guitar solo enhancing its depth. Originally by Kim Jeong-seo, this rendition serves as the theme for the Netflix series ""A Time Called You, "" blending retro soul influences with contemporary K-pop elements.",https://www.youtube.com/watch?v=oyn0BrS6v34
GODS,K-Pop/Pop,NewJeans,"An anthemic track with heavy synthetic stomp, confident vocals, and dramatic choir opening, diverging from ' usual style. The song's cinematic production and powerful vocals convey both the grind and glory awaiting players at Worlds. The music video follows Korean pro player Kim 'Deft' Hyuk-kyu's journey from discovering League of Legends in high school to becoming World Champion in 2022.",https://www.youtube.com/watch?v=hBJibJwU0SI
FEARLESS,K-Pop/Dance,LE SSERAFIM,"A 2:48 funk-infused alternative pop track in A minor at 104 BPM, featuring smooth basslines, whispered vocals, and minimalist production, conveying themes of self-assurance and resilience.; verse–pre–hook–chorus form; earworm motif; tight vocal comp; plate reverb; mid‑tempo groove; bright acoustic elements; soft saturation on bus",https://www.youtube.com/watch?v=4vbDFu0PUew
ANTIFRAGILE,K-Pop/Pop,LE SSERAFIM,"An Afro-Latin pop track blending reggaeton rhythms with a catchy ""anti-ti-ti-ti fragile"" hook, featuring a tempo of 105 BPM in B-flat minor, with a duration of 3 minutes and 4 seconds; instrumentation includes programmed drums, bass, and synths; structure comprises verses, pre-chorus, chorus, and post-chorus; lyrics convey themes of resilience and growth through adversity.",https://www.youtube.com/watch?v=vsgdqdbQuc8
UNFORGIVEN,K-Pop/Pop,LE SSERAFIM,"A 3:02 hip-hop track in E minor at 104 BPM, featuring Nile Rodgers' funk guitar and sampling Ennio Morricone's ""The Good, the Bad and the Ugly."" The song blends hip-hop and punk rhythms, with lyrics about breaking societal norms and embracing individuality. The music video showcases Western-inspired visuals, including scenes of members donning cowboy hats and riding a white horse through a devastated city.",https://www.youtube.com/watch?v=2yImBQyQ13U
CRAZY,K-Pop/Electronic,LE SSERAFIM,"Upbeat house EDM track with deep bass, addictive synths, and rhythmic rap verses; features voguing choreography; lyrics express intense emotions when meeting someone who drives them wild; music video showcases surreal and kitschy scenes; collaboration with American dance team Iconic House of Juicy Couture; released as lead single from fourth extended play; received multiple first-place awards on South Korean music programs.",https://www.youtube.com/watch?v=Sw120IXPv2Y
EASY,K-Pop/Pop,LE SSERAFIM,"Mid-tempo R&B-trap track in C major at 165 BPM, featuring warm synth pads, deep sub-bass, and crisp programmed drums. Vocals are delivered with airy falsetto and subtle autotune effects, creating a smooth, laid-back atmosphere. Lyrically, it explores themes of confidence and resilience, juxtaposing external perceptions with internal struggles. The accompanying music video, shot in Los Angeles, presents a surreal, dreamlike aesthetic, enhancing the song's introspective mood.",https://www.youtube.com/watch?v=eAdqhLFmHa8
HOT,K-Pop/Pop,LE SSERAFIM,"Mid-tempo pop track in C minor, 4/4 time signature, approximately 90 BPM, blending rock and disco elements with a smooth, funky groove. Features resonant bassline, sultry guitar riffs, breathy falsetto vocals, and harmonies, creating a laid-back yet passionate atmosphere. Lyrically explores themes of love and devotion, with members delivering lines in Korean, English, and Japanese, reflecting the group's multicultural background. The song's production is polished, with a subtle rock influence",https://www.youtube.com/watch?v=acg8RO1O7ZI
PERFECT NIGHT,K-Pop/Pop,LE SSERAFIM,"A 2-step garage track blending soft, catchy melodies with addictive guitar riffs, featuring airy falsetto vocals and a lo-fi sheen, conveying joy of being with friends; collaborative music video with Overwatch 2; topped Melon's Top 100 chart, first English song by K-pop girl group to do so; topped Spotify's global chart, highest-ranking K-pop group on chart; topped Melon's weekly chart, first English song by K-pop girl group to do so; topped Bugs' weekly chart for three consecutive weeks;",https://www.youtube.com/watch?v=OkYj93iDQyI
DIFFERENT,K-Pop/Electronic,LE SSERAFIM,"Upbeat disco funk track with groovy rhythm guitar, bold brass elements, and lively percussion; energetic vocals layered over dynamic instrumental backdrop; lyrics convey self-confidence and individuality; music video features playful storyline with vibrant colors and stylized direction; choreography stands out with high energy and creativity; fans praise visuals and anticipate live performance.",https://www.youtube.com/watch?v=HFZUAXhdnHk
KAWAII,K-Pop/Pop,LE SSERAFIM,"Upbeat track in C major, 120 BPM, 4/4 time, 3:48 duration, produced by Gen Hoshino, features dynamic analog synths, skittering drums, and catchy melodies, blending J-pop influences with K-pop elements; serves as theme song for Netflix's 'My Melody & Kuromi', promoting self-expression and embracing individuality; music video filmed at Sanrio Puroland in Tokyo, blending live-action and animation, immersing viewers in whimsical world of Sanrio characters.",https://www.youtube.com/watch?v=30jphsRMpmo
Jasmine,Hip-Hop/R&B,DPR Live,"A 3:21 track in A♭ major at 138 BPM, blending R&B and hip-hop with live instrumentation and electronic elements. Features smooth, soulful melodies, warm harmonies, and introspective lyrics. Production by CODE KUNST. Music video showcases natural beauty, filmed in Pacific Northwest coastline. Achieved over 100 million Spotify streams by February 2024.",https://www.youtube.com/watch?v=a6MCQ8KGZ-8
Martini Blue,Hip-Hop/R&B,DPR Live,"Mid-tempo R&B track in F# minor, 4/4 time, approximately 80 BPM, featuring smooth falsetto vocals, warm electric guitar, and subtle synths. Lyrically, it explores deep emotional connection and romantic devotion, using """" as a metaphor for profound love. The song's production creates a relaxed, seductive atmosphere, enhanced by ad-libs and a mellow vibe.",https://www.youtube.com/watch?v=LatFDXXoEXA
Know Me,Hip-Hop/R&B,"DPR Live, DEAN","Mid-tempo 134 BPM track in A# minor, featuring 4/4 time signature and 3:24 duration. Combines warm guitar riffs with deep sub-bass, layered over crisp programmed drums. 's assertive rap delivery contrasts with 's soulful falsetto, creating a dynamic interplay. Lyrically explores themes of self-expression and confidence, challenging public perceptions. Released as part of the 2017 EP ""Coming To You Live, "" it showcases a fusion of hip-hop and R&B influences.",https://www.youtube.com/watch?v=4Ok5qKK4b0Q
Hula Hoops,Hip-Hop/R&B,"DPR Live, Beenzino, Hwasa","Upbeat hip-hop track featuring warm guitar riffs, airy falsetto vocals, and programmed drums, set in a 4/4 time signature at 90 BPM, in the key of C minor, lasting 3 minutes and 23 seconds; lyrics celebrate individuality and self-expression, with references to ""icy hoops"" and """" symbolizing unique qualities and confidence.",https://www.youtube.com/watch?v=IXYiGcj8UMg
Text Me,R&B,DPR Live,"Upbeat hip-hop track with smooth rap verses and melodic vocals, featuring gentle keys, groove-inflected guitars, and synth-heavy instrumentation. Incorporates rhythmic iMessage notification sounds, enhancing digital communication theme. Performed live on COLORS SHOW with vibrant turquoise backdrop and hot pink sweater, reflecting artist's energetic stage presence.",https://www.youtube.com/watch?v=4K00cvWWlzw
Summer Tights,Hip-Hop/R&B,DPR Live,"120 BPM, F# minor, 4/4 time signature, 3:30 duration; groovy guitar riffs, smooth bassline, syncopated drums; flirty lyrics about infatuation; music video features roller-skating scenes; artist learned roller-skating for the video; music video directed and edited by DPR IAN; music video includes cameo by CL; music video filmed in locations similar to CL's ""5 STAR"" MV.",https://www.youtube.com/watch?v=00uzprkOeJQ
Playlist,Hip-Hop/R&B,DPR Live,"Mid-tempo hip-hop track in C# minor, 4/4 time signature, approximately 90 BPM, featuring warm piano melodies, smooth basslines, and crisp percussion; introspective lyrics explore themes of attraction and desire, with a laid-back groove and atmospheric production.; looped motif; ad‑lib textures; roomy vocal; slap‑back delay throws",https://www.youtube.com/watch?v=n0LYGzYt6DU
Yellow Cab,Hip-Hop/R&B,DPR Live,"Upbeat tempo track blends hip-hop rhythms with rock elements, featuring prominent electric guitar riffs and dynamic drumming. Incorporates 1980s-inspired visuals, with vibrant neon hues and retro cinematography. Lyrically explores themes of artistic struggle and desire for recognition within the Korean music industry. Music video narrative follows protagonist's journey through time, symbolizing challenges faced by independent artists. Produced by Dream Perfect Regime DPR crew, showcasing",https://www.youtube.com/watch?v=mvJUGkX8K7w
Legacy,Hip-Hop/Pop,DPR Live,"Fast-paced 150 BPM track in E minor, featuring tight trap beats, booming bass, and eerie synths. 's sharp vernacular and wordplay highlight his success and confidence. The music video presents an atmospheric intergalactic adventure, with vibrant lighting and dynamic camerawork. The song's production is complex, with subtle tempo shifts and layered elements that enhance its unique sound.",https://www.youtube.com/watch?v=72cONDjtLGc
Kiss Me,R&B/Pop,DPR Live,"Mid-tempo 176 BPM track in F# major with 4/4 time signature, blending lo-fi synths, jazzy piano, and subtle violins to create a dreamy, spacey atmosphere. Lyrically, it explores themes of intimacy and self-acceptance, set against a cosmic backdrop. The accompanying music video features neon colors and futuristic visuals, enhancing the song's ethereal vibe.",https://www.youtube.com/watch?v=kGi4CRlJA6w
Action!,Hip-Hop,"DPR Live, Gray","Mid-tempo 103 BPM track in C# minor, 3:10 duration, 4/4 time signature, featuring warm electronic keys, smooth falsetto vocals, and subtle programmed drums; lyrics depict a cinematic love story, inviting a woman to star in his 'movie, ' blending modern urban lifestyle with romantic infatuation.; verse–hook rotation; minimal chord movement; punchy master",https://www.youtube.com/watch?v=sH1W7XU8Sh8
Jam & Butterfly,R&B/Soul,"DPR Live, Crush, eaJ","Mid-tempo R&B track in F# minor at 148 BPM, featuring smooth vocals from and, blending hip-hop and R&B elements. 's unique aspirated tone and sing-rap style create a dreamy soundscape. Lyrically, it explores themes of love and infatuation through metaphors like ""caramello high"" and ""butterfly, "" conveying the euphoric feelings of new romance.",https://www.youtube.com/watch?v=SQBuVfTX1ME
Please,Hip-Hop,"DPR Live, Kim Hyo-eun, G2, Dumbfoundead","Mid-tempo hip-hop track in C minor, 4/4 time, approximately 90 BPM, featuring layered synths, deep basslines, and crisp percussion. Collaborative verses from four artists, each delivering confident, assertive lyrics. 's verse emphasizes authenticity and dismisses insincere rappers. 's contribution highlights self-assurance and the importance of positive influences. 's verse incorporates pride and defiance, addressing critics and asserting his success. 's verse focuses on personal experiences,",https://www.youtube.com/watch?v=tXvpe2GbUec
Laputa,Hip-Hop/R&B,"DPR Live, Crush","A 123 BPM track in E minor, featuring smooth rap verses and soulful melodies, blending hip-hop and R&B elements. The song's title references a floating island from Jonathan Swift's ""Gulliver's Travels, "" symbolizing an ethereal, unattainable love. Critics note its futuristic neo-soul sound, with bluesy synths and mysterious baritone vocals, creating a dreamy atmosphere. The collaboration with adds depth, enhancing the track's emotional resonance.",https://www.youtube.com/watch?v=ZNLnbWiI7tY
Diamonds + and Pearls,Hip-Hop/R&B,"DPR Live, DPR Ian, peace.","A high-energy track blending 1970s rock and pop influences, featuring layered vocals and dynamic instrumentation. The song's lyrics explore themes of ambition and materialism, with references to ""diamonds in the sky"" and ""Lucy, "" alluding to ""Lucy in the Sky with Diamonds."" Released as part of the 2021 ""Shang-Chi and the Legend of the Ten Rings"" soundtrack, it showcases the artists' versatility and ability to convey powerful messages through their music.",https://www.youtube.com/watch?v=y8FAGSaeI1Y
How You Like That,K-Pop/Pop-Trap,BLACKPINK,"This dynamic track blends EDM, hip-hop, and trap, featuring a tempo of 120 BPM in the key of C minor, structured in 4/4 time signature, with a duration of 3:01. Instrumentation includes synthesized basslines, punchy programmed drums, and regal horn blasts, creating an empowering anthem about resilience and confidence. The song's music video, directed by Seo Hyun-seung, set multiple YouTube records upon release.",https://www.youtube.com/watch?v=mIuNiH2MAO8
Shut Down,Hip-Hop/EDM,BLACKPINK,"Hip-hop track at 110 BPM in B-flat minor, blending trap beats with a looped classical violin sample from Paganini's ""La Campanella."" Features insistent bass, strings, and rap verses, delivering empowering lyrics that assert dominance over critics. Music video references past works, showcasing high-fashion aesthetics and dynamic choreography. Critics praise its innovative fusion of genres and confident delivery.",https://www.youtube.com/watch?v=JDRyqUx1X8M
Pink Venom,Trap/EDM/K-Pop,BLACKPINK,"A dynamic blend of hip-hop, pop rap, dance, and EDM, this track features traditional Korean instruments like geomungo and gayageum, set in C minor at 90 BPM. The composition intertwines airy geomungo plucks with electropop beats, leading into rap verses reminiscent of 90s hip-hop. Lyrically, it juxtaposes themes of sweetness and danger, embodying the group's duality. The music video showcases bold fashion and synchronized choreography, enhancing the song's empowering message.",https://www.youtube.com/watch?v=3or3dp3qNQU
DDU-DU DDU-DU,Hip-Hop/EDM,BLACKPINK,"This dynamic pop-rap track features a prominent trap beat infused with bubblegum pop elements, blending oriental percussion rhythms and whistling with trap production. Its addictive chorus and gun-shooting dance move have drawn huge popularity among K-pop fans, elevating the video to first place in the world's most viewed K-pop music video in 2018.",https://www.youtube.com/watch?v=pYKPJl1PIIw
Kill This Love,Pop/Trap,BLACKPINK,"A stomping electropop track blending trap elements, featuring blaring horns and martial percussion. Rosé and Jisoo lead impassioned pre-choruses about breaking up. The song's production has been described as ""practically biblical"" and ""weirdly dated, "" with some critics noting it could have been produced in the early 2010s.",https://www.youtube.com/watch?v=1JgNRkZ4_lk
Lovesick Girls,Dance Pop/Electro,BLACKPINK,"Upbeat dance-pop track with electropop elements, featuring acoustic guitar strumming and rhythmic percussion. Tempo of 128 BPM in G-flat major key. Dynamic structure with emotive verses, rap sections, and anthemic chorus. Lyrically explores themes of heartbreak and independence. Critics praise its catchy melody and vocal performances, noting its departure from previous styles. Music video showcases energetic choreography and vibrant visuals.",https://www.youtube.com/watch?v=kLoqdvCtl9M
Boombayah,EDM/Hip-Hop,BLACKPINK,"High-energy EDM track with pulsating 128 BPM tempo, set in C minor key, 4/4 time signature, 4-minute duration; features dynamic programmed drums, electrifying synths, and rap verses; explosive chorus with repeated """" refrain; showcases 's ""girl crush"" concept blending fierce independence with undeniable charm; music video directed by Seo Hyun-seung, released August 8, 2016, surpassed 1.6 billion views as of July 2023; certified gold by RIAJ and RMNZ, silver by BPI; debuted at number seven on",https://www.youtube.com/watch?v=husJE0_Y_FQ
As If It’s Your Last,Disco-Pop,BLACKPINK,"Upbeat track blends shimmery synth-pop, house, reggae, moombahton, and disco grooves, featuring catchy melodies and energetic vocals. Incorporates elastic club beats, laid-back hip-hop verses, and triumphant brass elements. Chorus delivers pure pop perfection with smooth, straightforward production. Music video showcases vibrant, colorful scenes with dynamic choreography, highlighting group's versatility. Released as part of group's ""Pink"" concept, marking a departure from previous ""Black""",https://www.youtube.com/watch?v=64q9zY13PVc
Playing With Fire,EDM/Pop,BLACKPINK,"Mid-tempo tropical house track in B minor, 90 BPM, 4/4 time, 3:19 duration, featuring layered synths, programmed drums, and dynamic vocals. Lyrically, it explores the perilous allure of intense love, likening it to . The music video, directed by Seo Hyun-seung, has amassed over 900 million views as of December 2024. Choreography by Kyle Hanagami complements the song's energetic vibe. The track achieved significant commercial success, topping the Billboard World Digital Song Sales chart and",https://www.youtube.com/watch?v=BmzAGDnJzss
Whistle,Alt Hip-Hop/Pop,BLACKPINK,"A minimalist hip-hop track in B major at 103 BPM, featuring a sparse drum 'n' bass beat, heartbeat-like pulses, and prominent motifs. Vocals alternate between whispered verses and assertive choruses, with snaps and claps accentuating the rhythm. The song's structure builds from subdued whispers to dynamic, explosive sections, reflecting themes of desire and confidence. Critics praised its fresh take on the 'girl crush' concept, with Billboard ranking it among the best K-pop songs of 2016.",https://www.youtube.com/watch?v=4lQvwoiIXPQ
Pretty Savage,Trap/K-Pop,BLACKPINK,"A 3:19 trap anthem with 85 BPM, featuring chanted vocals, skittish beats, and prowling piano, delivering a defiant message of unapologetic self-worth. Critics praise its hypnotic intensity and assertive energy, with Rolling Stone calling it the ""sassiest kiss-off track since Ariana Grande's 'Thank U, Next'."" The track has amassed over 200 million views on YouTube, underscoring its widespread appeal.",https://www.youtube.com/watch?v=F8c8f2nK82w
Ice Cream,Pop/Bubblegum,"BLACKPINK, Selena Gomez","Upbeat electropop track in E major, 80 BPM, 2:56 duration, blending bubblegum pop with trap elements. Features playful vocals from five artists, including and members, with a rap verse in Korean. Lyrically, it employs metaphors to convey flirtation and allure. Accompanied by a vibrant music video showcasing colorful, candy-themed visuals. Debuted at number 13 on the US Billboard Hot 100, marking a significant achievement for a female Korean act.",https://www.youtube.com/watch?v=gazx7220q0g
Forever Young,EDM/Pop,BLACKPINK,"Mid-tempo moombahton track with house beats and reggaeton swing, blending tropical vibes with energetic drops; lyrics celebrate youth and self-confidence; features dynamic rap verses and harmonized vocals; certified platinum in South Korea; included in Japanese compilation album; performed at Coachella 2019; praised for vibrant energy and catchy composition.",https://www.youtube.com/watch?v=s_7yNDzG7OI
Typa Girl,Trap/Pop,BLACKPINK,"A 3-minute hip-hop-pop-electronic track in G Major at 132 BPM, featuring trap beats, synths, organ, brass, and piano. Noted for its empowering lyrics and sassy wordplay, it peaked at number 16 on the Billboard Global 200. Critics praised its addictive beat and confident tone, though some questioned its originality. Fans highlighted Rosé's unexpected rap performance, drawing comparisons to Lisa's style.",https://www.youtube.com/watch?v=UhxW9Njqqu0
Don’t Know What To Do,EDM/Pop,BLACKPINK,"Mid-tempo electropop track in B minor, 4/4 time, 3:22 duration, featuring throbbing bass, whistle-like hook, and acoustic guitar elements. Vocals showcase emotional depth, with Jisoo's falsetto and Rosé's breathy delivery. Lyrically explores post-breakup confusion and longing. Notably performed at Coachella 2019, highlighting 's versatility beyond their typical trap-influenced sound.",https://www.youtube.com/watch?v=1oYwBgFOTHg
Bet You Wanna,Pop/Hip-Hop,"BLACKPINK, Cardi B","Upbeat pop track featuring catchy vocals and a rap verse, blending bubblegum pop with hip-hop elements. Simple beat enhanced by group's voices and rapper's flow. Lyrically, it promises a good time to a significant other. Released in 2020, it received positive reviews, with critics praising its catchy nature and the collaboration's success. Notably, it was 's first collaboration with a rapper.",https://www.youtube.com/watch?v=gXBdvSj9F2I
JUMP,Pop/EDM,BLACKPINK,"Fast-paced hardstyle and dance-pop anthem blending club music, synth-pop, European techno, and EDM; energetic tempo; striking guitar riff evoking Western film; addictive chorus; co-written by Teddy, Diplo, 24, Zikai, Claudia Valentina, Jumpa, Malachiii, and Jesse Bluu; co-produced by Diplo, 24, Boaz van de Beatz, Zecca, and Ape Drums; released July 11, 2025; music video directed by Dave Meyers; debuted at number one on Billboard Global 200; reached 100 million YouTube views in 15 days; part of",https://www.youtube.com/watch?v=RUKqwwyAiEU
THE GIRLS (OST),Pop/EDM,BLACKPINK,"An EDM and trap fusion track featuring hip-hop beats and Turkish flute motifs, driven by dynamic programmed drums and sub-bass, with a duration of 2 minutes and 42 seconds. The song's structure includes verses, a pre-chorus, and a chorus, with lyrics emphasizing independence and courage. The accompanying animated music video showcases the group's avatars performing synchronized choreography. The track received mixed reviews, with some fans expressing excitement and others criticizing its",https://www.youtube.com/watch?v=cSqOY5nktfg
Crazy Over You,Trap/Pop,BLACKPINK,"A dynamic fusion of retro hip-hop and minimalist trap, this track features a Balkan whistle and surf rock guitar, blending Eastern and Western influences. The production is marked by a bass-heavy drop and distinctive ""eee-eee-eee-eee"" vocal ad-libs. Critics have noted its experimental nature, with some finding the transitions between sections jarring, while others appreciate its unique sound. The song has achieved significant streaming success, surpassing 100 million streams on Spotify.",https://www.youtube.com/watch?v=Wu9EupoKUls
See U Later,Pop/Trap,BLACKPINK,"Mid-tempo dance-pop track at 107 BPM, blending pop and hip-hop with trap-laden chorus, reminiscent guitar, and distorted 808 bass. Features reverb-drenched vocals and rap verses, creating a dynamic, swagger-filled atmosphere. Notably banned by KBS for explicit language. Critics praise its catchy hook and empowering themes, though some find the chorus repetitive. Achieved over 100 million streams on Spotify, reflecting its popularity.",https://www.youtube.com/watch?v=fpimnj4SNjQ
bad,Indie Rock/Pop,Wave to Earth,"Upbeat indie track with mellow synths, soft percussion, and warm guitar, featuring airy falsetto vocals and lo-fi sheen; lyrics depict transformative love turning mundane day into joyful experience.; mid‑tempo groove; bright acoustic elements; soft saturation on bus; verse–pre–hook–chorus form; earworm motif; tight vocal comp; plate reverb",https://www.youtube.com/watch?v=6Q5xqNkCk7w
love.,Indie/Bedroom Pop,Wave to Earth,"A 5:07 track from ""0.1 flaws and all."" album, blending indie pop, rock, R&B, and sophisti-pop. Features a prominent guitar riff throughout, accompanied by exposed vocals and rhythmic beats. Lyrically explores human connections, personal growth, and love's transformative power. Live performances highlight its emotional depth and rawness.",https://www.youtube.com/watch?v=Q49pnA4jsp8
seasons,Indie Rock/Jazz Pop,Wave to Earth,"Slow-tempo indie ballad in C major, 4/4 time, approximately 70 BPM; features warm electric guitar, subdued bass, and gentle drums; introspective lyrics explore themes of unrequited love and self-doubt; evokes feelings of melancholy and longing; part of ""Summer Flows 0.02"" album; praised for its calming and uplifting qualities; resonates with listeners seeking solace in music.",https://www.youtube.com/watch?v=CnVVjLOGVoY
sunny days,Indie Rock,Wave to Earth,"Mid-tempo indie track in C major, 4/4 time, approximately 90 BPM, featuring warm guitar strums, mellow basslines, and soft percussion. Lyrically, it celebrates love's transformative power, turning ordinary moments into joyful experiences. The accompanying music video, filmed in the Philippines, showcases vibrant street scenes, enhancing the song's uplifting mood. bandwagon.asia",https://www.youtube.com/watch?v=hRjC3ek0Oxk
peach eyes,Indie Pop,Wave to Earth,"Indie pop track from 2023 album ""0.1 Flaws and All"" features mellow tempo, warm synths, and soft vocals. Lyrically, it explores deep affection and emotional reliance, symbolized by """" representing warmth and comfort. The song's structure includes a repeating chorus and verses expressing longing and devotion. Notably, the term """" was inspired by the band's first international performance in Thailand, where the innocence and happiness of fans' eyes evoked this imagery.",https://www.youtube.com/watch?v=Q-UZygeboOc
