title,genre,artists,song_desc,youtube_url
Where You Are,House,"John Summit, Hayla","126 BPM, A minor, 4/4, 5:10; A soulful house track featuring 's emotive vocals over a dynamic bassline and uplifting melodies, blending deep house and progressive elements. The song has achieved significant success, reaching the top 10 on Billboard's Hot Dance/Electronic Songs chart and topping the US Dance Radio chart. It has been remixed by artists like GRiZ, Gorgon City, and Zedd, each adding their unique style to the track. The original release was accompanied by a lyric video on YouTube.",https://www.youtube.com/watch?v=5BqjhUmldDc
Shiver,House,"John Summit, Hayla","127 BPM, E minor, 4/4, 3:54; Energetic 127 BPM house track in E minor, featuring pulsating basslines, ethereal synths, and 's emotive alto vocals. Released February 14, 2024, it follows their 2023 hit ""Where You Are, "" which peaked at #8 on Billboard's Hot Dance/Electronic Songs Chart. """" is poised to be a festival staple, blending euphoria with wistful nostalgia.",https://www.youtube.com/watch?v=3PyoQ0EBXzs
Go Back,House,"John Summit, Julia Church","136 BPM, G minor, 4/4, 3:41; A dynamic electronic track blending house and drum & bass elements, featuring 's emotive vocals. The song begins with a steady tempo, incorporating piano and horns, before transitioning into an energetic drum & bass sequence. Notably, the tempo increases mid-track, enhancing its euphoric energy. The production is clean, with infectious melodies and kinetic basslines, creating an uplifting atmosphere. The track has been praised for its innovative fusion of genres and",https://www.youtube.com/watch?v=o9Bgl8HUFZA
Eat the Bass,Tech House,John Summit,"128 BPM, 4/4, 3:23; Pulsing at 128 BPM in F# minor, this tech house track features a deep, growling bassline, hypnotic percussive motifs, and gritty, pulsing synths, creating a dark, high-energy atmosphere. The repetitive vocal refrain ""I just need to, so let me dance"" emphasizes the track's focus on the visceral experience of music, making it a staple in club and festival settings.",https://www.youtube.com/watch?v=oSuUCudW7Jk
Focus,House,"John Summit, CLOVES","128 BPM, F# major, 4/4, 3:58; Dark, moody synths and groovy house beat; lush, ethereal vocals; trance-heavy instrumentals; pulsating rhythmic synths; introspective yet energizing; hauntingly emotive; immersive listening experience; dynamic and immersive; captivating; euphoric; trance-infused; festival-ready; introspective; emotive; immersive; captivating; euphoric; trance-infused; festival-ready; introspective; emotive; immersive; captivating; euphoric; trance-infused; festival-ready;",https://www.youtube.com/watch?v=P6GPG_dpq0A
La Danza,House,John Summit,"126 BPM, F# minor, 4/4, 2:38; A high-energy tech house track with a driving four-on-the-floor beat, featuring a chunky bassline, rhythmic drums, and an infectious Latin-inspired vocal loop. Released in March 2022 on Defected Records, it quickly became a summer anthem, earning significant airplay and chart success. The track's vibrant energy and catchy rhythm have made it a staple in dance music playlists.",https://www.youtube.com/watch?v=9Mv4ogXpjCM
Sun Came Up,House,"John Summit, Sofi Tukker","124 BPM, A minor, 4/4, 3:23; Hypnotic house track featuring breathy vocals and intricate Spanish guitar, seamlessly blending sensuality with rhythmic energy. Collaborative effort between New York duo and Chicago's, combining their distinctive styles into a unique sound. Inspired by quarantine experiences, the song reflects themes of togetherness and hope, capturing both nostalgia and anticipation. Released in 2021, it showcases a fusion of global influences and electronic dance music elements.",https://www.youtube.com/watch?v=N9RrlA69WvU
What a Life,House,"John Summit, Guz, Steve Appleton","126 BPM, G minor, 4/4; Upbeat house track at 126 BPM in G minor, featuring breezy guitar riffs, uplifting vocals, and groovy basslines. Released July 29, 2022, it quickly became a summer anthem, charting at #37 on US Dance/Electronic charts. Notably performed live at Madison Square Garden in 2024, enhancing its reputation as a crowd favorite.",https://www.youtube.com/watch?v=a6nw8XxdDu4
Deep End,House,John Summit,"124 BPM, F major, 4/4; Chicago-born producer's 2020 house track features groovy percussion, rolling bassline, and hypnotic vocals, blending deep house and tech house elements. Released on Defected Records, it topped Beatport charts, earning Pete Tong's Essential New Tune and BBC Radio 1 playlist spots. Remixed by SIDEPIECE, Black V Neck, and SIDEPIECE Extended Remix, each adding unique basslines and builds. Vocals by Foushee.",https://www.youtube.com/watch?v=_3eJi3yPgY4
Show Me,House/Pop,"John Summit, Hannah Boleyn","126 BPM, D minor, 4/4, 2:57; A 2:57 tech house track in C minor, featuring a 4/4 time signature and approximately 124 BPM, combining deep basslines, crisp programmed drums, and atmospheric synths with soulful vocals, creating a moody yet energizing vibe.; groove‑locked percussion; off‑beat hats; sustained chords; build‑to‑peak energy curve",https://www.youtube.com/watch?v=EwJEWWJKoQI
Sweet Disposition (Remix),House,"John Summit, Silver Panda, Temper Trap","This 2024 remix of an Australian indie rock anthem infuses the original with a driving 126 BPM progressive house rhythm in B minor, featuring a 4/4 time signature and a duration of 4 minutes and 11 seconds. The track is characterized by pulsating sub-bass, crisp percussion, and atmospheric synths, creating an uplifting and energetic atmosphere. Listeners have praised its explosive energy and club-ready appeal, with comments like ""extraordinary"" and ""tokio drift.""",https://www.youtube.com/watch?v=WStAm_BrkGI
Is Everybody Having Fun?,House,"John Summit, Gorgon City, rhys","Upbeat house track features driving 124 BPM tempo, uplifting major key, 4/4 time signature, 3:30 duration, with groovy bassline, rhythmic percussion, catchy vocal hooks, and dynamic build-ups. Celebrates joy and togetherness, blending deep house elements with energetic drops. Released in 2025, it showcases artists' signature styles, contributing to vibrant dance music scene.",https://www.youtube.com/watch?v=U9tetObVhQg
light years,House,"John Summit, Inéz","High-energy house track at 138 BPM in E minor, featuring deep, punchy basslines and bright, melodic synths. 's commanding vocals add depth, creating an infectious groove. Blends euphoric builds with deep basslines, alternating tension and release. Summit's signature rhythms infused with stutter house vibes. Tested at major events like Ultra Miami and The Sphere in Las Vegas. Released under Experts Only label.",https://www.youtube.com/watch?v=FNHfPqti1V8
Hungover,House,"John Summit, Mathame, Camden Cox","A 136 BPM deep house track in D minor, this 3:40-minute song features ethereal vocals from, blending uplifting trance beats with melancholic melodies. Its 4/4 time signature and energetic tempo create a dancefloor-ready atmosphere, capturing the bittersweet aftermath of a night out. The collaboration between and showcases their signature house/electro production style, marking a significant release in the electronic music scene.",https://www.youtube.com/watch?v=VaGQQrhXxmE
Fade Out,House,"John Summit, MKLA","Energetic house track featuring ethereal vocals, pulsating bassline, and expansive synths, blending trance and electro-pop elements into a euphoric, uplifting atmosphere. Notable for its entrancing vocal performance and cinematic breaks, creating a captivating listening experience. Released as the final single under Off The Grid Records, marking a significant moment in the artist's career.",https://www.youtube.com/watch?v=ScCqgbx9u18
Palm of My Hands,House,"John Summit, Venbee","Liquid drum and bass track featuring mellow vocals over lo-fi electronic synths, characterized by a tempo of 170 BPM, set in E major, and a 4/4 time signature; original version is 2:11 minutes long, with an extended remix by Odd Mob; released as part of 's debut album ""Comfort In Chaos"" in 2024; received positive reviews for its light, airy, and lively feel, appealing to liquid drum and bass enthusiasts.",https://www.youtube.com/watch?v=d2jQjvNtawA
Tears,House,"John Summit, Paige Cavell","A 3:56 progressive house track at 170 BPM in D♭ minor, featuring 's emotive vocals over deep sub-bass and crisp programmed drums, with a dynamic 4/4 rhythm; released July 12, 2024, as part of 's debut album ""Comfort In Chaos, "" exploring themes of love and heartbreak.; DJ‑friendly intro/outro; 8‑bar phrasing; filter sweeps; reverb throws",https://www.youtube.com/watch?v=WvykfdsLmO0
Resonate,House,"John Summit, Kaskade, Julia Church","A 130 BPM house track in G major, featuring 's evocative vocals over atmospheric synths and a pulsating bassline, building to an emphatic beat drop. Celebrated for its fusion of emotional melodies and heavy techno production, it has become a festival favorite, with live performances at Coachella and EDC Las Vegas. Listeners praise its captivating energy and dancefloor appeal.",https://www.youtube.com/shorts/wEtINjVUaPo
Good Things Fall Apart,Future Bass/Pop,"Illenium, Jon Bellion","A dynamic fusion of future bass and pop-rock, this track features glitchy beats, delicate acoustic guitar, and ethereal percussion, building to a powerful crescendo. 's emotive vocals soar over the production, delivering introspective lyrics that explore themes of heartbreak and self-doubt. The song's anthemic quality is enhanced by its cinematic music video, depicting a dystopian escape from a crumbling Earth. Released in 2019, it achieved significant chart success, peaking at number four on",https://www.youtube.com/watch?v=J9Zjgb03FMQ
Crawl Outta Love,Future Bass,"Illenium, Annika Wells","A deep, earth-shattering ballad in G Major at 85 BPM, featuring emotive vocals over piano melodies and future bass breakdowns. The track's chord progression is C–G–D–Am. It won the International Songwriting Competition's grand prize in 2017. The accompanying music video, released in January 2018, features breathtaking drone shots and thematic elements that fans will recognize from Miller's album and single artwork.",https://www.youtube.com/watch?v=gbxxpSNE5o4
Takeaway,Future Bass/EDM,"The Chainsmokers, Illenium, Lennon Stella","Future bass track featuring emotive vocals, melancholic piano, lush acoustic guitar, and skittering synths, blending soft melodies with hard-hitting drums; released July 24, 2019, as part of ' 'World War Joy' and 's 'Ascend' albums; reached number one on Billboard's Dance/Mix Show Airplay Chart in November 2019; music video filmed at New York City's Vessel; remixed by artists including Andrew Rayel, Sondr, Ship Wrek, Pilton, Owen Norton, and DCB.",https://www.youtube.com/watch?v=NgpMP5SfMJM
Fractures,Future Bass,"Illenium, Nevve","A melodic future bass track featuring ethereal vocals, warm guitar licks, and orchestral strings, building from a gentle introduction to a powerful, bass-driven climax. The song's introspective lyrics explore themes of transformation and finding the courage to break free from constraints. It has been praised for its emotional depth and has become a fan favorite in live performances.",https://www.youtube.com/watch?v=ZCu2gwLj9ok
Hearts on Fire,Future Bass,"Illenium, Dabin, Lights","A 3:56 melodic dubstep track blending rock and pop elements, featuring emotive vocals and guitar riffs, swelling synths, and powerful drum crashes. Released on December 25, 2020, it achieved #1 on both Billboard Dance/Mix Show Airplay and Mediabase Dance Radio charts. The accompanying music video portrays two separated lovers reuniting in a dystopian setting, symbolizing hope and reconnection.",https://www.youtube.com/watch?v=Sqq1KZF03-I
Nightlight,Melodic Bass,Illenium,"A melodic bass track featuring ethereal vocals, dynamic percussion, and emotive synths, blending organic elements with modern production techniques. The song's structure builds from intimate verses to powerful drops, creating an uplifting atmosphere. Its themes of resilience and hope are underscored by cinematic soundscapes and a memorable guitar melody. The accompanying music video enhances the narrative with captivating visuals.",https://www.youtube.com/watch?v=klp-RReW0jY
In Your Arms,Future Bass,"Illenium, X Ambassadors","A 148 BPM future bass track in D major, blending warm synths with ' emotive vocals, featuring a dynamic drop and atmospheric build-ups, exploring themes of love and acceptance.; focused arrangement; clear motif development; dynamic contour with defined peaks; layered textures; tasteful automation; tight low‑end management; polished master",https://www.youtube.com/watch?v=mt1mXwBLsSE
Feel Good,Future Bass/Pop,"Gryffin, Illenium, Daya","Energetic future bass track featuring 's soaring vocals over dynamic synths and guitar riffs, blending electronic and organic elements. Released March 3, 2017, through Darkroom/Interscope Records. Peaked at number 6 on New Zealand Heatseekers chart. Certified Platinum by RIAA and ARIA. 's production incorporates real guitar and piano for an organic feel.",https://www.youtube.com/watch?v=L2OR9XoFFWw
Don’t Let Me Down (Remix),Future Bass/Remix,"The Chainsmokers, Illenium","This remix features emotive vocals over a dynamic arrangement blending future bass and chill trap elements. The track is set in B major, with a tempo of 80 BPM, and follows a 4/4 time signature. It has a duration of 3 minutes and 38 seconds. The remix is characterized by uplifting melodic basslines, soaring synths, and euphoric drops, creating an emotionally resonant atmosphere. It has garnered significant popularity, amassing over 144 million streams on Spotify since its release.",https://www.youtube.com/watch?v=yHd_aD8Hmfw
Beautiful Creatures,Future Bass,"Illenium, MAX","Uplifting electronic track at 117 BPM in C minor, featuring 's soulful vocals over warm synths and rhythmic programmed drums. Characterized by euphoric melodies and dynamic drops, it blends future bass and melodic dubstep elements. Celebrates human resilience and inner strength, resonating with listeners seeking empowerment. Part of 's 2017 album ""Awake, "" it showcases his signature emotive production style.",https://www.youtube.com/watch?v=omT5rKmU5_k
Good Things Fall Apart,Future Bass/Pop,"Illenium, Jon Bellion","A fusion of glitchy beats, delicate acoustic guitar, and ethereal percussion, this track features dynamic vocals that transition from intimate verses to an explosive chorus, channeling early 2000s pop-punk and emo influences. The song's introspective lyrics explore themes of heartbreak and self-doubt, set against a backdrop of melancholic melodies and bright synth work. Its cinematic music video depicts a dystopian future, adding a visual narrative to the song's emotional depth.",https://www.youtube.com/watch?v=aha8QskUYhU
Ascend,Future Bass/EDM,"Illenium, various collaborators","Uplifting future bass track featuring ethereal vocals, soaring melodies, and dynamic drops; collaborations with artists like Jon Bellion, X Ambassadors, and The Chainsmokers; incorporates elements of rock, dance-pop, and dubstep; notable for its emotive themes and immersive production; received acclaim for its cohesive vision and innovative soundscapes.",https://www.youtube.com/watch?v=vz1owwBQvTY
Starfall,Melodic Bass,Illenium,"A 4:16 track in D♯ minor at 146 BPM, featuring lush synths, emotive background vocals, and a dynamic drop, blending cinematic imagery inspired by gaming and anime.; layered textures; tasteful automation; tight low‑end management; polished master; contrast between sparse verses and dense climaxes; ear‑catching transitions",https://www.youtube.com/watch?v=asE3ZKMaI88
Reverie,Future Bass,"Illenium, King Deco","A 2016 electronic track blending ethereal vocals with uplifting melodies, featuring smooth piano riffs and heavy synth drops. The song's structure includes calming verses transitioning into energetic drops, creating an electrifying yet relaxing atmosphere. It has been praised for its ability to transport listeners to a warmer, happier place.",https://www.youtube.com/watch?v=AcwyvOkS9BA
Rush Over Me,Melodic Bass,"Seven Lions, Illenium, Said the Sky, Haliene","A 135 BPM, 4/4 melodic dubstep track in C major, featuring ethereal vocals, atmospheric synths, and emotive drops, blending dubstep, trance, and future bass elements. Released in 2016, it charted at number 50 on the Billboard Hot Dance/Electronic Songs chart. In 2021, released a trance remix as part of his '1999' EP, reimagining the original with classic trance elements.",https://www.youtube.com/watch?v=nw2qYEqRLa4
Fortress,Future Bass,"Illenium, Joni Fatora","A 3:24 track in F major, 142 BPM, 4/4 time, featuring ethereal vocals over warm synths and subtle percussion, blending melodic dubstep with ambient elements. Critics note its emotional depth and cinematic build, with one reviewer highlighting its ""dreamy, floating-in-space atmosphere"" and ""euphoric and emotional"" drop. A remix by Seven Lions transforms it into an uplifting trance anthem.",https://www.youtube.com/watch?v=5auyUSI6as4
Soft Spot,Alt R&B/Pop,keshi,"Mid-tempo 106 BPM track in B major, 3:24 duration, 4/4 time signature, featuring warm electric guitar strums, soft piano melodies, and subtle programmed drums. Breathy falsetto vocals convey emotional vulnerability, exploring themes of love, self-doubt, and personal growth. Noted for its romantic, dreamy, and groovy atmosphere, reminiscent of autumn walks. Released as part of the album ""Requiem, "" it showcases a departure from the artist's usual introspective style,",https://www.youtube.com/watch?v=1GFpjG_5ZV4
UNDERSTAND,Alternative/Pop,keshi,"A 2:30 track in B Major 1B, 131 BPM, 3/4 time signature, featuring warm guitar, airy falsetto, and subtle programmed drums, creating an intimate, contemplative atmosphere. Critics highlight its minimalistic production and emotional depth, with one reviewer noting it as ""one of the most beautiful tracks in this album and certainly one of the best songs he made.""",https://www.youtube.com/watch?v=6DcUnqZqTvI
LIMBO,Alt R&B/Pop,keshi,"Mid-tempo 90 BPM track in C# minor, 3:32 duration, blending lo-fi hip-hop beats with dreamy guitar and piano, creating an introspective atmosphere. Lyrics explore self-doubt and identity, resonating with listeners navigating personal uncertainty. Critics highlight its fusion of genres and emotional depth, noting its appeal to fans of alternative R&B and indie pop. The song has garnered significant streaming success, reflecting its widespread resonance.",https://www.youtube.com/watch?v=ssIiBm0ORuI
Say,R&B/Pop,keshi,"Upbeat 149 BPM track in G major, blending alt-R&B with city-pop influences; features warm guitar, atmospheric synths, soft percussion; smooth falsetto vocals; introspective lyrics about unspoken emotions and longing; co-produced by Elie Rizk, Malay, Imad Royal; released July 2024 as lead single from 'Requiem' album; accompanied by cinematic Seoul-filmed music video.",https://www.youtube.com/watch?v=sI97pJcyeOs
beside you,Alt R&B/Indie,keshi,"A breezy pop track co-produced with Madeon, featuring melancholic acoustic guitar plucks, soft pads, and airy falsetto vocals. Released in April 2021, it quickly amassed over 3 million streams in three days, marking a significant debut. The song's intimate production and relatable themes of love and longing have resonated with listeners, solidifying its place in contemporary R&B-pop.",https://www.youtube.com/watch?v=mMYfOB_rzac
2 soon,Lo-fi/Alt R&B,keshi,"Mid-tempo track in C# minor, 3:26 duration, 4/4 time signature, featuring warm guitar, airy falsetto vocals, and programmed drums. Released August 21, 2018, as lead single from debut EP ""The Reaper."" Live performances often include remixed climaxes and new intros. Resonates with listeners through themes of regret and longing.",https://www.youtube.com/watch?v=LKZyp2cSAy4
like i need u,Lo-fi/Alt R&B,keshi,"120 BPM track in F major, 4/4 time signature, 3:02 duration; features warm guitar, airy falsetto, programmed drums, sub-bass, lo-fi sheen; explores unreciprocated love, longing, vulnerability; resonated with listeners, becoming 's breakout hit.; layered textures; tasteful automation; tight low‑end management; polished master",https://www.youtube.com/watch?v=40QXPac2sQM
IT'S YOU,R&B/Pop,"Max, keshi","A 2:53 track in D major at 90 BPM, featuring warm falsetto vocals and a deep, soulful lower register, accompanied by rhythmic acoustic guitar and subtle electronic elements. The song's structure includes verses, a chorus, and a bridge, creating an intimate atmosphere that highlights the effortless nature of love. Listeners have praised its emotive melodies and poignant lyrics, noting its blend of pop and R&B influences.",https://www.youtube.com/watch?v=zWxuc8L0W_Y
Bodies,Alternative/R&B,keshi,"Mid-tempo 109 BPM track in F# minor, blending alternative R&B, indie pop, and lo-fi elements. Features soft guitar riffs, ambient synths, subtle percussion, and breathy falsetto vocals. Lyrically explores themes of love, detachment, and the transient nature of human connections. Described as a hauntingly beautiful song that captivates listeners with its dreamy yet melancholic atmosphere. .ng",https://www.youtube.com/watch?v=hWpziGEcZPA
drunk,Alternative R&B,keshi,"Mid-tempo 105 BPM track in E major, 4/4 time signature, 3:47 duration, featuring soft acoustic guitar strumming, subtle piano, and emotive falsetto vocals. Lyrically, it delves into themes of loneliness and introspection, contrasting social revelry with personal solitude. Critics praise its raw emotional depth and minimalist production, highlighting its resonance with listeners navigating complex relationships.",https://www.youtube.com/watch?v=4HLumkaPcCI
Dream,Indie/Alt R&B,keshi,"A 3:30 track in D Major at 75 BPM, featuring sparse piano motifs and ethereal vocals, creating a dreamy atmosphere. The song delves into themes of nostalgia and longing, portraying the struggle of moving on from a past relationship while grappling with idealized memories that haunt the present. The production is lush yet open, with intentional piano melodies that complement the vocals without overpowering them. The song's structure is simple yet effective, with concise lyrics that convey deep",https://www.youtube.com/watch?v=QxEYJTsk2EE
Night,Alt R&B,keshi,"A haunting 3-minute track in D minor, 103 BPM, featuring syncopated percussion, 808s, and atmospheric strings, conveying themes of insomnia, anxiety, and emotional turmoil. Listeners praise its visceral vocals and evocative production, noting its ability to evoke deep emotional responses. The song's introspective lyrics and compelling instrumentation have resonated with audiences, making it a standout piece in the artist's repertoire.",https://www.youtube.com/watch?v=j5JeqNAnpVE
Texas,Alternative/Pop,keshi,"A nostalgic track featuring warm acoustic guitar layers, subtle percussion, and emotive vocals, blending lo-fi elements with a fuller instrumental arrangement. The song is in A major, with a tempo of 80 BPM and a 4/4 time signature. It explores themes of longing and self-discovery, reflecting on personal growth and the desire to return to one's roots. The production amplifies these themes, allowing the artist's voice to shine with intensity and emotional depth.",https://www.youtube.com/watch?v=KE8c23r9PLI
Like That,Alt R&B/Pop,keshi,"Upbeat R&B track features smooth falsetto vocals over warm guitar plucks and airy synths, set in a 4/4 time signature with a tempo of 90 BPM. Lyrically, it delves into themes of desire and intimacy, capturing the excitement and carefree nature of a romantic relationship. The song's production is characterized by its lo-fi sheen, creating an intimate atmosphere that resonates with listeners. Critics have noted its blend of lo-fi R&B vibes with intimate storytelling, creating a laid-back yet",https://www.youtube.com/watch?v=zIrtq7VlJtg
B.Y.S.,Alternative/Indie,keshi,"Mid-tempo 2:45 track in C# minor, 4/4 time, features warm falsetto vocals over lo-fi guitar strums and subtle programmed drums, creating an intimate, melancholic atmosphere. The song's narrative explores unreciprocated love, with lyrics expressing devotion despite emotional turmoil. The accompanying music video portrays a bank heist with an ambiguous twist, symbolizing the complexities of one-sided affection.",https://www.youtube.com/watch?v=2A_jsFJ5DFU
Always,Indie/Alt R&B,keshi,"A mellow R&B track featuring smooth falsetto vocals, gentle electric piano, and live-played guitar solos, delving into themes of love, loss, and regret. The song's structure is characterized by a steady tempo and a relaxed groove, creating an intimate atmosphere. Critics highlight its introspective lyrics and cohesive production, noting its ability to evoke deep emotional resonance.",https://www.youtube.com/watch?v=CgfBfZQ3ZBo
Right Here,Alt R&B/Pop,keshi,"Mid-tempo track in C# minor, 4/4 time signature, approximately 80 BPM; features warm electric guitar, lo-fi trap beats, and emotive falsetto vocals; introspective lyrics explore themes of longing and unresolved emotions; production blends acoustic elements with electronic textures, creating a moody, atmospheric soundscape; received praise for its heartfelt delivery and innovative fusion of genres.",https://www.youtube.com/watch?v=dCzZFsoA2C8
Skeletons,Indie/Lo-fi R&B,keshi,"80 BPM, D major, 4/4 time signature, 2:32 duration; lo-fi indie track blending warm acoustic guitar with subtle synths and trap-inspired beats; introspective lyrics exploring mental health struggles and self-doubt; production by NOVA WAV; received praise for its emotional depth and relatability; noted for its melancholic yet calming atmosphere.",https://www.youtube.com/watch?v=2U5wNk-fbew
