title,genre,artists,song_desc,youtube_url
Break Free,EDM/Pop,"Ariana Grande, Zedd","Upbeat electro-pop anthem in G minor, 130 BPM, 4/4 time; features pulsating synths, throbbing bassline, soaring vocals; lyrics about empowerment and liberation; production by and Max Martin; released July 2014; reached number four on US Billboard Hot 100; praised for catchy melody and Grande's vocal performance; music video inspired by sci-fi themes; certified multi-platinum in several countries.",https://www.youtube.com/watch?v=2Ek3WMM7I-0
Starving,Pop/Dance,"Hailee Steinfeld, Grey, Zedd","Upbeat pop track featuring breathy vocals, warm low mids, and intimate high-end sibilance; dynamic shifts between chest and head voice; rhythmic heartbeat effect synchronized with ""you make my heart beat faster"" line; production by and; released July 19, 2016; reached top 10 in Australia, Canada, Denmark, Ireland, New Zealand, and UK; charted at number 12 in US; music video directed by Darren Craig; over 100 million Spotify streams.",https://www.youtube.com/watch?v=ScjT8zvT7d0
Happy Now,EDM/Pop,"Zedd, Elley Duhé","Mid-tempo pop ballad in C major, 4/4 time, approximately 100 BPM, 3:10 duration, featuring acoustic guitar, piano, and layered synths. Vocals convey bittersweet post-breakup emotions, blending melancholy with uplifting melodies. Critics note its organic instrumentation and emotional depth, marking a departure from 's earlier electro-centric productions. Music video presents a dark narrative contrasting the song's bright sound.",https://www.youtube.com/watch?v=2Z6XcNY-Af4
Good Thing,Pop/Electronic,"Zedd, Kehlani","Mid-tempo 186 BPM pop-electronic track in 4/4 time, blending synth-driven melodies with soulful vocals; features staccato piano intro, layered synths, and percussive elements; lyrics convey self-assurance and independence; music video set in upscale restaurant, with dynamic choreography; received positive reviews for empowering message and genre fusion.",https://www.youtube.com/watch?v=DQXPnwxnbbo
Inside Out,EDM/Pop,"Zedd, Griff","Upbeat dance-pop track featuring airy falsetto vocals over bouncy future-pop production with breezy leads and lush synths. Tempo around 120 BPM, in C major, 4/4 time signature, 3:06 duration. Delicate piano riffs and programmed drums create a warm, inviting atmosphere. Themes of embracing inner beauty and personal connections. Released October 23, 2020, by Interscope Records. Accompanied by a music video directed by Rianne White and Ali Kurr.",https://www.youtube.com/watch?v=ijC3cp8AlK8
Addicted to a Memory,Electro House,"Zedd, Bahari","An electro house track featuring soaring female vocals over a four-on-the-floor beat, evolving into complex, gritty synths and nostalgic 8-bit video game chords; incorporates rapid-fire electro synths and a steadily thumping bassline; ends with a 20-second coda reminiscent of early video game music; duration: 5:03; tempo: 128 BPM; key: C# major; time signature: 4/4.",https://www.youtube.com/watch?v=ZqJiXLJs_Pg
365,Pop/Electronic,"Zedd, Katy Perry","Upbeat dance-pop track features catchy melodies, rhythmic verses, and infectious chorus, blending electronic beats with pop sensibilities. Accompanied by a sci-fi-themed music video depicting an AI robot's emotional journey, adding depth to the song's narrative. Released on February 14, 2019, it achieved chart-topping success in Bulgaria and Israel, and top 10 positions in several other countries.",https://www.youtube.com/watch?v=YrbgUtCfnC0
True Colors,Electronic Pop,"Zedd, Kesha (album version)","Mid-tempo D minor ballad at 126 BPM, featuring Kesha's emotive vocals spanning A3 to D5, accompanied by muted keyboard melodies, building to dynamic drums and bells. Noted for its moody, gothic electro ballad style, marking Kesha's return after a three-year hiatus.; verse–pre–hook–chorus form; earworm motif; tight vocal comp; plate reverb",https://www.youtube.com/watch?v=weEV0Jf0Urk
Lost at Sea,EDM/Progressive,"Zedd, Ryan Tedder","Midtempo electronic track in C# minor, 4/4 time signature, approximately 120 BPM; features 's emotive falsetto vocals over 's lush synths and deep bassline; dynamic build-ups and drops create an immersive atmosphere; lyrics explore themes of love, longing, and isolation; released in 2012 as part of 's debut album, ""Clarity""; praised for its emotional depth and production quality.",https://www.youtube.com/watch?v=O7S21zudhtY
Make You Say,Dance/Pop,"Zedd, Maren Morris, BEAUZ","Upbeat dance-pop track features 's emotive vocals over and 's crisp production, blending electronic beats with funk-infused instrumentation. Co-written by, Morris, , Charlie Puth, and Jacob Kasher Hindlin, it marks 's first return to the same vocalist since ""The Middle."" The accompanying music video, part of Apple's ""Made on iPad"" campaign, combines live-action with colorful animations.",https://www.youtube.com/watch?v=4HrU1EbataI
Love Is Gone,Melodic Bass/EDM,"SLANDER, Dylan Matthew","A cinematic, melodic dubstep track featuring emotive vocals, blending delicate piano keys with swelling orchestral elements, building tension through fast-paced buildups and trap-inspired breakdowns, creating a cathartic journey from heartbreak to hope.; festival‑scale build; supersaw stack; white‑noise risers; hard sidechain",https://www.youtube.com/watch?v=hCrtcVDgCGw
Walk On Water,Melodic Bass/Pop,"SLANDER, RØRY, Dylan Matthew","A six-minute melodic bass track featuring emotive vocals from and, characterized by celestial drops and anthemic breakdowns. Debuted during 's Coachella performance, it was later included in their debut album. The song's production is noted for its emotive lyrics about rekindling a lost love.; groove‑locked percussion; off‑beat hats; sustained chords; build‑to‑peak energy curve",https://www.youtube.com/watch?v=NALy88obwr0
Wish I Could Forget,Electronic/Pop,"SLANDER, blackbear, Bring Me The Horizon","A cinematic electronic track blending melodic dubstep with alternative rock elements, featuring emotive vocals and atmospheric synths. The song's structure builds tension through dynamic drops and soaring melodies, creating an immersive listening experience. Themes of heartbreak and memory are explored, resonating with listeners seeking catharsis. The collaboration between the artists marks a significant fusion of genres, appealing to fans of both electronic and rock music.",https://www.youtube.com/watch?v=Ry9hn4GkRMM
If Tomorrow Never Happens,Melodic Bass/EDM,"SLANDER, Nikademis, Poo Bear","A 75 BPM melodic bass track in D minor, featuring smooth vocals and gentle melodies that build into a euphoric drop blending rock and future bass elements. The song explores themes of living in the present and cherishing moments, with lyrics questioning potential regrets if tomorrow never comes. It debuted live at Ultra Music Festival and EDC Las Vegas, resonating with festival-goers and listeners alike.",https://www.youtube.com/watch?v=Yr5NqP2lELs
Potions,Melodic Bass,"SLANDER, Said The Sky, JT Roach","A melodic future bass track featuring ethereal vocals over gentle acoustics, blending 's anthemic sound with 's signature style, creating an emotionally charged atmosphere.; contrast between sparse verses and dense climaxes; ear‑catching transitions; layered textures; tasteful automation; tight low‑end management; polished master",https://www.youtube.com/watch?v=XyfWV_BTLd0
Superhuman,Melodic Bass,"SLANDER, Eric Leva","Future bass track in G major, 128 BPM, 4:29 duration, featuring emotive vocals over deep piano chords and vibrant synths; smooth drops and punchy drum fills create an uplifting atmosphere; praised for its emotional depth and melodic richness, blending smooth vocals with powerful synths; described as an emotional rollercoaster and a prime example of future bass; remixed by Gammer and Spag Heddy, adding unique twists to the original.",https://www.youtube.com/watch?v=-sHagClUhCI
All You Need to Know,Progressive EDM,"Gryffin, SLANDER, Calle Lehmann","A 140 BPM future bass track in C major, featuring 's emotive vocals over warm synths, vibrant piano, and skittering percussion, blending melodic elements with artful basslines for an uplifting, euphoric atmosphere.; snare roll lifts; sub‑reinforced drop; stereo widened leads; formant shifts; festival‑scale build; supersaw stack; white‑noise risers; hard sidechain",https://www.youtube.com/watch?v=J-STI5eZFfw
First Time,Melodic Bass,"SLANDER, Dylan Matthew","An emotionally charged melodic dubstep track featuring soaring vocals over ethereal melodies, vibrant synths, and powerful percussion, blending heavy bass with euphoric elements for a cathartic listening experience.; layered textures; tasteful automation; tight low‑end management; polished master; contrast between sparse verses and dense climaxes; ear‑catching transitions",https://www.youtube.com/watch?v=oyxklxISius
Your Fault,Melodic Bass,"SLANDER, KALEENA ZANDERS, GONE","A dynamic house track featuring gospel-infused vocals, uplifting melodies, and pulsating beats, blending soulful energy with contemporary dance rhythms.; layered textures; tasteful automation; tight low‑end management; polished master; contrast between sparse verses and dense climaxes; ear‑catching transitions",https://www.youtube.com/watch?v=lQtFKVc175c
Broken Hearted,Melodic Bass,"SLANDER, San Holo, Julia Church","A melodic dubstep track featuring ethereal vocals, gentle guitar strums, and expansive synths, building toward euphoric drops with distorted vocal chops and subtle riddim elements, creating a cinematic journey of emotional recovery.; focused arrangement; clear motif development; dynamic contour with defined peaks",https://www.youtube.com/watch?v=0yIhZHJ2lwA
Back To U,Future Bass/EDM,"SLANDER, William Black","A melodic bass track featuring emotive vocals and a somber guitar riff, building to a euphoric drop with mid-range synths and concise drum patterns, released on Gud Vibrations.; snare roll lifts; sub‑reinforced drop; stereo widened leads; formant shifts; festival‑scale build; supersaw stack; white‑noise risers; hard sidechain",https://www.youtube.com/watch?v=sPSm7E_cnfU
FEELING GUD,Pop/Electronic,"SLANDER, Matthew Santos","Upbeat electronic track at 174 BPM in F minor, blending future bass and dubstep elements. Features ' soulful vocals, sampling Nina Simone's ""Feeling Good."" Dynamic drops with pitch-shifted vocals and evolving synths create an energetic atmosphere. Released by Gud Vibrations label, it has garnered significant attention, amassing over 67 million Spotify streams since its February 2020 release.",https://www.youtube.com/watch?v=LLp6Q_4I_-c
Higher Power,House/Electronic,"Gryffin, Lavern, AR/CO","Upbeat dance track featuring ethereal vocals, vibrant synths, and deep basslines, creating a whimsical yet grinding dance heater. Combines melodic finesse, sleek style, and transcendent songwriting. Shimmers with late-night aura, blending nostalgia with propulsion. Aims to be a summer banger, blending three unique worlds into a beacon of hope.",https://www.youtube.com/watch?v=lrMKKcaQOOg
Hard Time Lover,Indie Electronic,"Gryffin, Chance Peña","A 3:05 indie-dance track in G Major at 105 BPM, featuring 's emotive vocals and delicate guitar lines, exploring complexities of supporting someone through dark times. 's production blends acoustic textures with rhythmic, melodic elements, creating a poignant yet uplifting atmosphere. Released via 10K Projects on June 6, 2025, it showcases 's return to his indie roots while maintaining his signature dance energy.",https://www.youtube.com/watch?v=e1Klhcekv-Y
In My Head,House/Electronic,"Gryffin, Kaskade, Nu-La","Slow-burning house track featuring ethereal chord progressions, deep emotive grooves, and soaring vocals from UK artist . Gated tremolo synths flutter into focus like a breaking wave, driving yet dreamlike. The collaboration between and blends their respective styles, creating a warm, sing-along energy perfect for winter months.",https://www.youtube.com/watch?v=JFC05H301xs
Tie Me Down,Pop/Electronic,"Gryffin, Elley Duhé","Energetic dance-pop track in F# major, 99 BPM, 4/4 time, 3:38 duration, featuring 's soulful vocals over uplifting melodies, blending tropical house guitar with melodic house undertones; lyrics explore themes of desire and commitment; received critical acclaim, charting on Billboard's Hot Dance/Electronic Songs; gained popularity in Japan, topping Apple Music and iTunes Store dance charts in 2022.",https://www.youtube.com/watch?v=yzr4vItHf24
Woke Up in Love,Dance Pop,"Gryffin, Kygo, Calum Scott","This 3:36 track in C major features a 4/4 time signature and a tempo of 120 BPM, blending tropical house and dance-pop elements. 's emotive vocals are complemented by and 's production, characterized by warm synths, subtle piano, and rhythmic percussion. The song's uplifting mood evokes sun-drenched coasts and freedom, aligning with themes of healing and self-love post-heartbreak.",https://www.youtube.com/watch?v=qKrCDDHsGSU
Feel Good,Future Bass/Pop,"Gryffin, Illenium, Daya","This energetic EDM-pop anthem features 's soulful vocals over a dynamic blend of synths and guitar textures, creating an uplifting atmosphere. The track's production incorporates innovative synth sounds and reimagined guitar elements, reflecting 's unique style of merging electronic music with organic instruments. The song's lyrics explore themes of positivity and emotional support, resonating with listeners seeking an uplifting musical experience.",https://www.youtube.com/watch?v=L2OR9XoFFWw
Nobody Compares To You,Pop/Electronic,"Gryffin, Katie Pearlman","Future bass track featuring gentle guitar strokes, piano chimes, and 's emotive vocals, building into euphoric drops with lush synths and bouncy bass. Released October 6, 2017, it peaked at number 85 on Billboard's Hot Dance/Electronic Songs chart in 2018.; verse–pre–hook–chorus form; earworm motif; tight vocal comp; plate reverb",https://www.youtube.com/watch?v=gRG_5SQVARc
Body Back,Pop/Electronic,"Gryffin, Maia Wright","Upbeat dance-pop track at 123 BPM in A♭ major, featuring 's emotive vocals over shimmering synths and rhythmic programmed drums. 's production blends tropical house elements with melodic guitar riffs, creating a euphoric atmosphere. Lyrically, it explores themes of defiance and resilience in love, urging a partner to return despite external judgments. Released on October 18, 2019, it peaked at number 14 on New Zealand's Hot Singles chart.",https://www.youtube.com/watch?v=Q_ovUTp40V8
All You Need To Know,Progressive EDM,"Gryffin, SLANDER, Calle Lehmann","Mid-tempo electronic track fuses warm guitar riffs with orchestral elements, featuring Swedish vocalist's emotive delivery; builds to euphoric drop blending trap influences and soaring melodies, creating uplifting atmosphere.; extended intro/outro; 8‑bar phrasing; energy‑mapped arrangement; festival‑scale build; supersaw stack; white‑noise risers; hard sidechain",https://www.youtube.com/watch?v=J-STI5eZFfw
Forever,Pop/Electronic,"Gryffin, Elley Duhé","Upbeat 138 BPM house track in G# major, 3:07 duration, 4/4 time signature, featuring ethereal synths, dynamic programmed drums, and 's emotive vocals. Themes of living in the moment and embracing life's fleeting nature. Second collaboration between and Duhé, following 2019's ""Tie Me Down."" Released as part of 's sophomore album, ""Alive, "" on November 4, 2022.",https://www.youtube.com/watch?v=BY7XRDwGT2w
Cry,Pop/Electronic,"Gryffin, John Martin","Uplifting dance anthem at 145 BPM in C♯ major, featuring bright pads, atmospheric synths, and dynamic drops; combines acoustic guitar melodies with electronic elements, creating an energetic, danceable track.; clean topline; layered harmonies; glossy synth pads; punchy drums; mid‑tempo groove; bright acoustic elements; soft saturation on bus",https://www.youtube.com/watch?v=enbNUqSZdD8
Just For A Moment,Pop/Electronic,"Gryffin, Iselin","Uplifting future bass track in C# minor at 144 BPM, featuring 's emotive vocals over vibrant synths and dynamic programmed drums. Structured in 4/4 time, it delivers a cinematic drop that evokes nostalgia and longing. The song's production complements the lyrical content perfectly, with its energetic and dynamic sound.",https://www.youtube.com/watch?v=mgFe6_O57ww
Desire (Remix),Deep House,"Years & Years, Gryffin","This remix features a driving tempo of approximately 120 BPM, set in a major key, and structured in a 4/4 time signature. It blends deep house elements with indie dance, incorporating warm guitar riffs, smooth basslines, and uplifting synth melodies. The track gained prominence as the lead single for the 'We Are Your Friends' soundtrack, aligning with the film's themes of ambition and the pursuit of dreams.",https://www.youtube.com/watch?v=c3TP9aMnoik
Scandalous,House/Pop,"Gryffin, Tinashe","Up-tempo dance track featuring sultry vocals over shimmering synths and pulsating bass, creating an irresistible call to the dancefloor. Captures lightning-in-a-bottle passion and uninhibited revelry between two people magnetically drawn to each other.; DJ‑friendly intro/outro; 8‑bar phrasing; filter sweeps; reverb throws",https://www.youtube.com/watch?v=mJ_IQ-G2-Uk
Whole Heart,Future Bass/Pop,"Gryffin, Bipolar Sunshine","Upbeat 164 BPM track in A major, blending acoustic guitar with pulsating synths and mid-tempo rhythms; features anthemic vocals addressing societal issues and urging unity.; clean topline; layered harmonies; glossy synth pads; punchy drums; mid‑tempo groove; bright acoustic elements; soft saturation on bus",https://www.youtube.com/watch?v=PWhMoGt0cs8
Best Is Yet To Come,Pop/Electronic,"Gryffin, Kyle Reynolds","Uplifting electronic track featuring emotive vocals over warm piano and bass synths, creating an anthemic atmosphere. Incorporates dynamic drops and rhythmic percussion, blending future bass and dance-pop elements. Released in June 2021, it conveys themes of hope and optimism, resonating with listeners seeking motivation. The song's production showcases a fusion of melodic dance music with heartfelt lyrics, appealing to fans of uplifting electronic anthems.",https://www.youtube.com/watch?v=FaA1-weqWgg
Keep U Safe,Melodic Bass,"ARMNHMR, Liv Miraldi","A 3:13 track in A major at 150 BPM, featuring soaring melodies, cinematic builds, and emotive vocals, blending melodic bass with heartfelt lyricism.; layered textures; tasteful automation; tight low‑end management; polished master; focused arrangement; clear motif development; dynamic contour with defined peaks",https://www.youtube.com/watch?v=ob7VcuyqVhs
Gone,Electronic/Pop,"ARMNHMR, KELIZA","Energetic house track featuring uplifting vocals, driving bassline, and dynamic percussion, blending melodic elements with rhythmic intensity. Released July 19, 2024, by and PASSPORT, with 's vocals. Extended Mix runs 4:53 minutes; remixes by YDG, YUSSI, and VNSSA released February 7, 2025. Celebrated for its festival mainstage appeal and positive energy.",https://www.youtube.com/watch?v=uW3HksJXSSA
My Eyes,Progressive EDM,ARMNHMR,"A 3:40 dubstep track with a tempo of 140 BPM, featuring emotive vocals, dynamic drops, and a blend of melodic interludes and energetic basslines. Released on July 4, 2025, it reflects themes of mindfulness and presence, encouraging listeners to slow down and appreciate the moment.; extended intro/outro; 8‑bar phrasing; energy‑mapped arrangement",https://www.youtube.com/shorts/MYJi1f0eOgA
Someone to Forget,Melodic EDM,"ARMNHMR, Lights","Mid-tempo electronic track in C minor, 4/4 time signature, approximately 90 BPM, blending melodic bass with live instrumentation, featuring emotive vocals and poignant lyrics exploring themes of love and loss.; festival‑scale build; supersaw stack; white‑noise risers; hard sidechain; snare roll lifts; sub‑reinforced drop; stereo widened leads; formant shifts",https://www.youtube.com/watch?v=4eSuxmAZF3U
Falling Apart,Melodic Bass,"ARMNHMR, RUNN","A melodic dubstep track in D♯ major at 145 BPM, featuring emotive vocals over dynamic guitar riffs and dramatic percussive elements. The song delves into themes of emotional vulnerability and the desire for companionship during challenging times. An acoustic rendition released in June 2022 offers a stripped-back version, highlighting the raw emotion of the original. A Crankdat remix released in August 2022 introduces a faster tempo of 150 BPM and a key change to C minor, adding a fresh",https://www.youtube.com/watch?v=xrUczVnuWDQ
Lifeline,Future Bass,"ARMNHMR, Trella","A 3:45 electro-pop track featuring airy vocals over house-influenced beats, blending melodic bass with uplifting melodies. Released on Monstercat in July 2023, it showcases a departure from the duo's usual style, incorporating early musical influences. The song's themes of vulnerability and seeking support are conveyed through its emotive production and lyrics.",https://www.youtube.com/watch?v=eleyCPO-168
Saving Lives,Melodic EDM,"ARMNHMR, Zack Gray","A 4-minute, 27-second track in C major at 142 BPM, featuring emotive vocals over a cinematic future bass backdrop with ethereal synths and dynamic percussion. The 3/4 time signature imparts a waltz-like rhythm, enhancing its introspective mood. Released on Monstercat in November 2021, it delves into themes of unreciprocated love and personal sacrifice, reflecting the artists' experiences during the early pandemic period.",https://www.youtube.com/watch?v=O-HAygr0xiw
Silver Lining,Melodic Bass,"ARMNHMR, KARRA","A melancholic melodic dubstep track in E minor, 152 BPM, 3:35 duration, featuring soaring female vocals, dynamic drops, and uplifting melodies. Listeners praise its high-energy drops and 's powerful voice, noting the track's unique production style. The song's themes of finding hope amid adversity resonate with fans, with some comparing its style to Seven Lions.",https://www.youtube.com/watch?v=sJnC2TM9tPI
Here With Me,Electronic/Pop,"ARMNHMR, Nevve","Mid-tempo future bass track approximately 100 BPM in C minor, 4/4 time, 3:25 duration, featuring ethereal vocals, lush synths, dynamic drops, and emotive melodies. The song explores themes of digital detachment and longing for genuine connection in a technology-driven world. It encourages listeners to reflect on how technology impacts relationships and to seek more meaningful connections.",https://www.youtube.com/watch?v=OKwaqDKX9DQ
Forever Young,Progressive EDM,"ARMNHMR, Melanie Fontana","Uplifting electronic track features lilting piano melodies, harmonies, and dynamic basslines, blending cinematic elements with vibrant synths. Embracing themes of resilience and youthful spirit, it encourages listeners to face life's challenges with optimism. Released as part of 's debut album, ""The Free World, "" in February 2020, it showcases a shift towards a more laid-back, future bass-oriented sound.",https://www.youtube.com/watch?v=CDHA0VTDb04
Fragile,Melodic Bass,"ARMNHMR, Melanie Fontana","A 138 BPM future bass track in D♭ major, featuring shimmering synths, anthemic kicks, and ethereal vocals, creating an empowering anthem about embracing vulnerability and inner strength.; layered textures; tasteful automation; tight low‑end management; polished master; focused arrangement; clear motif development; dynamic contour with defined peaks",https://www.youtube.com/watch?v=ekflCw1x-6o
Won't Make A Sound,Dance/Pop,"ARMNHMR, Pepper Rose","A dynamic fusion of melodic bass and pop-punk, this track features emotive vocals over a driving tempo, blending electronic elements with raw guitar riffs. The production seamlessly transitions between melancholic verses and intense drops, creating an energetic yet introspective atmosphere. Released in 2022, it showcases a collaboration that bridges genres, resonating with listeners seeking both nostalgia and modern energy.",https://www.youtube.com/watch?v=uW3HksJXSSA
Everybody Feels,Melodic Bass,"ARMNHMR, Maazel, Zack Gray","A cinematic future bass track featuring emotive vocals, soaring synths, and dynamic percussion, blending electronic and pop elements to create an uplifting atmosphere.; layered textures; tasteful automation; tight low‑end management; polished master; focused arrangement; clear motif development; dynamic contour with defined peaks",https://www.youtube.com/watch?v=TqDpRSodal0
Oceans,Melodic Bass,"ARMNHMR, NKOLO","Trap-tinged future bass track with uplifting synths, energetic programmed drums, and warm vocals, blending classical piano elements with electronic drops, creating an emotionally resonant atmosphere.; focused arrangement; clear motif development; dynamic contour with defined peaks; contrast between sparse verses and dense climaxes; ear‑catching transitions",https://www.youtube.com/watch?v=1Z9pnRRLPfE
Strangers,Melodic Bass/EDM,"Seven Lions, Myon & Shane 54, Tove Lo","A 2013 collaboration blending melodic dubstep and progressive house, featuring ethereal vocals over uplifting synths and a driving 4/4 rhythm, building to a dynamic drop. Noted for its emotive blend of dubstep, trance, and electro house, with a tempo of 128 BPM in the key of C minor. Described as a ""bright and swift tour-de-EDM-force with a touch of ethereal fantasy.""",https://www.youtube.com/watch?v=fthOxQ0rAds
Worlds Apart,Melodic Dubstep/Trance,"Seven Lions, Kerli","A 6:18 track in C minor, 4/4 time, 140 BPM, blending melodic dubstep with cinematic elements. Features ethereal vocals, atmospheric synths, and deep sub-bass. Builds tension with a haunting interlude before an impactful drop, combining heavy bass with harmonious melodies. 's vocals contrast dubstep's intensity, enhancing the track's emotional depth. Accompanied by a fantasy-themed music video depicting a knight and mermaid in a surreal world.",https://www.youtube.com/watch?v=ULqdjtDI-bs
